<?xml version="1.0" encoding="UTF-8"?>
<!DOCTYPE Pip5C2DesignRegistrationRequest SYSTEM "5C2_MS_V01_00_DesignRegistrationRequest.dtd">
<Pip5C2DesignRegistrationRequest>
  <DesignRegistrationInformation>
    <DesignProjectInformation>
      <DesignAssemblyInformation>
        <assemblyDescription>
          <TextualDescription>
            <summary>
              <FreeFormText>Xf</FreeFormText>
            </summary>
          </TextualDescription>
        </assemblyDescription>
        <assemblyName>
          <FreeFormText>mmLAkez 7317</FreeFormText>
        </assemblyName>
        <assemblyProductionDate>
          <DateStamp>59972085X</DateStamp>
        </assemblyProductionDate>
        <assemblyPrototypeDate>
          <DateStamp>45413495V</DateStamp>
        </assemblyPrototypeDate>
        <demandCreatorTrackingIdentifier>
          <ProprietaryReferenceIdentifier>122233887</ProprietaryReferenceIdentifier>
        </demandCreatorTrackingIdentifier>
        <DesignCustomerInformation>
          <designCustomer>
            <PartnerDescription>
              <BusinessDescription>
                <businessName>
                  <FreeFormText>mKClSSZ bTMwSQoZXXxvM</FreeFormText>
                </businessName>
                <PartnerBusinessIdentification>
                  <ProprietaryBusinessIdentifier>045976226</ProprietaryBusinessIdentifier>
                  <ProprietaryDomainIdentifier>VIaKvsuc yKtfHzxAe sXFVPsshyqSo</ProprietaryDomainIdentifier>
                </PartnerBusinessIdentification>
              </BusinessDescription>
              <GlobalPartnerClassificationCode>lvWOSqHs DeDVJamND NFdZcRpbwuOY</GlobalPartnerClassificationCode>
              <PhysicalLocation>
                <PartnerLocationIdentification>
                  <ProprietaryDomainIdentifier>neecnlLy ZfWOgIJLx joyPshXvUky</ProprietaryDomainIdentifier>
                  <ProprietaryLocationIdentifier>7020723956173</ProprietaryLocationIdentifier>
                </PartnerLocationIdentification>
                <PhysicalAddress>
                  <addressLine1>
                    <FreeFormText>354 NKjGp PgPOmy mjuxW</FreeFormText>
                  </addressLine1>
                  <addressLine2>
                    <FreeFormText>BJpEdNi mK  61358(8531</FreeFormText>
                  </addressLine2>
                  <cityName>
                    <FreeFormText>bjwiZvq</FreeFormText>
                  </cityName>
                  <GlobalCountryCode>dh</GlobalCountryCode>
                  <NationalPostalCode>27422</NationalPostalCode>
                  <regionName>
                    <FreeFormText>Ha</FreeFormText>
                  </regionName>
                </PhysicalAddress>
              </PhysicalLocation>
            </PartnerDescription>
          </designCustomer>
          <designCustomerApplicationEngineer>
            <PartnerDescription>
              <BusinessDescription>
                <businessName>
                  <FreeFormText>JBNgkia gaaMFpJeGBxxe</FreeFormText>
                </businessName>
              </BusinessDescription>
              <ContactInformation>
                <contactName>
                  <FreeFormText>Uu lSGWVCbW</FreeFormText>
                </contactName>
                <EmailAddress>ao@jmblLhwA.deOUkrnInwHnxqKSxAtA|Vb</EmailAddress>
                <telephoneNumber>
                  <CommunicationsNumber>1527489966</CommunicationsNumber>
                </telephoneNumber>
              </ContactInformation>
              <GlobalPartnerClassificationCode>tScjyLFg aWtvVkRCy YuJKBFhWTBrG</GlobalPartnerClassificationCode>
            </PartnerDescription>
          </designCustomerApplicationEngineer>
          <designCustomerDistributorBranch>
            <GlobalLocationIdentifier>5034305635129</GlobalLocationIdentifier>
          </designCustomerDistributorBranch>
          <GlobalPartnerClassificationCode>NZonfGmY yhLPFKymx uSoSJUiaSkLb</GlobalPartnerClassificationCode>
        </DesignCustomerInformation>
        <DesignPartInformation>
          <CoreProductRegistration>
            <DeviceProductRegistration>
              <isPartSelected>
                <AffirmationIndicator>jX</AffirmationIndicator>
              </isPartSelected>
              <isRegisterable>
                <AffirmationIndicator>sYG</AffirmationIndicator>
              </isRegisterable>
              <ProductIdentification>
                <PartnerProductIdentification>
                  <GlobalPartnerClassificationCode>rUFdtPMvcJaF</GlobalPartnerClassificationCode>
                  <ProprietaryProductIdentifier>mhW05579CWAU</ProprietaryProductIdentifier>
                </PartnerProductIdentification>
              </ProductIdentification>
              <RegistrationStatus>
                <GlobalRegistrationStatusCode>azgEFat</GlobalRegistrationStatusCode>
                <registrationStatusDate>
                  <DateStamp>76985118J</DateStamp>
                </registrationStatusDate>
              </RegistrationStatus>
              <unitPrice>
                <ProductPricing>
                  <FinancialAmount>
                    <GlobalCurrencyCode>HKR</GlobalCurrencyCode>
                    <MonetaryAmount>5.67</MonetaryAmount>
                  </FinancialAmount>
                  <GlobalPriceTypeCode>ZXujawwsT AxnfdN APsQS</GlobalPriceTypeCode>
                </ProductPricing>
              </unitPrice>
            </DeviceProductRegistration>
            <isPartSelected>
              <AffirmationIndicator>se</AffirmationIndicator>
            </isPartSelected>
            <isRegisterable>
              <AffirmationIndicator>pjz</AffirmationIndicator>
            </isRegisterable>
            <ProductIdentification>
              <PartnerProductIdentification>
                <GlobalPartnerClassificationCode>PRFtaqEFQbuX</GlobalPartnerClassificationCode>
                <ProprietaryProductIdentifier>tDE84776</ProprietaryProductIdentifier>
              </PartnerProductIdentification>
            </ProductIdentification>
            <RegistrationStatus>
              <GlobalRegistrationStatusCode>OsbHeBy</GlobalRegistrationStatusCode>
              <registrationStatusDate>
                <DateStamp>58527182c</DateStamp>
              </registrationStatusDate>
            </RegistrationStatus>
            <unitPrice>
              <ProductPricing>
                <FinancialAmount>
                  <GlobalCurrencyCode>OWy</GlobalCurrencyCode>
                  <MonetaryAmount>4.07</MonetaryAmount>
                </FinancialAmount>
                <GlobalPriceTypeCode>WpBIHjhkE JDvEih tpudx</GlobalPriceTypeCode>
              </ProductPricing>
            </unitPrice>
          </CoreProductRegistration>
          <demandCreatorFieldApplicationEngineer>
            <ContactInformation>
              <contactName>
                <FreeFormText>UbFSfvp             jkAwDktL</FreeFormText>
              </contactName>
              <EmailAddress>vevOZSaFq#dlmFB]Rse</EmailAddress>
              <telephoneNumber>
                <CommunicationsNumber>2470570875</CommunicationsNumber>
              </telephoneNumber>
            </ContactInformation>
          </demandCreatorFieldApplicationEngineer>
          <demandCreatorSalesRepresentative>
            <ContactInformation>
              <contactName>
                <FreeFormText>pixRkn         CNyPhrB</FreeFormText>
              </contactName>
              <EmailAddress>astXJOqA[rLXXQ!bvT</EmailAddress>
              <telephoneNumber>
                <CommunicationsNumber>8410722414</CommunicationsNumber>
              </telephoneNumber>
            </ContactInformation>
          </demandCreatorSalesRepresentative>
          <demandCreatorTrackingIdentifier>
            <ProprietaryReferenceIdentifier>771021597</ProprietaryReferenceIdentifier>
          </demandCreatorTrackingIdentifier>
          <DesignRegistrationIdentification>
            <GlobalDesignRegistrationNotificationCode>jNS xYyElbH</GlobalDesignRegistrationNotificationCode>
          </DesignRegistrationIdentification>
          <GeographicRegion>
            <GlobalCountryCode>Gf</GlobalCountryCode>
          </GeographicRegion>
          <partConfidencePercent>
            <PercentAmount>37</PercentAmount>
          </partConfidencePercent>
          <productProviderFieldApplicationEngineer>
            <ContactInformation>
              <contactName>
                <FreeFormText>um</FreeFormText>
              </contactName>
              <EmailAddress>Sf</EmailAddress>
              <telephoneNumber>
                <CommunicationsNumber>4925339273</CommunicationsNumber>
              </telephoneNumber>
            </ContactInformation>
          </productProviderFieldApplicationEngineer>
          <productProviderSalesRepresentative>
            <ContactInformation>
              <contactName>
                <FreeFormText>uhJnVnoT bpbdVK</FreeFormText>
              </contactName>
              <EmailAddress>Pi</EmailAddress>
              <telephoneNumber>
                <CommunicationsNumber>6857957424</CommunicationsNumber>
              </telephoneNumber>
            </ContactInformation>
          </productProviderSalesRepresentative>
          <ProductQuantity>9</ProductQuantity>
        </DesignPartInformation>
        <DesignRegistrationIdentification>
          <GlobalDesignRegistrationNotificationCode>FMD ikcqnNj</GlobalDesignRegistrationNotificationCode>
        </DesignRegistrationIdentification>
        <estimated1stYearAssemblyQuantity>
          <ProductQuantity>036</ProductQuantity>
        </estimated1stYearAssemblyQuantity>
        <RegistrationStatus>
          <GlobalRegistrationStatusCode>xuCOAAK</GlobalRegistrationStatusCode>